Interface Label;Required/Optional;Definition;Value Type;Example;Guidance;Values
pre-existing conditions and risk factors;Optional;Patient pre-existing conditions and risk factors.;Enums;Anemia;Select all of the risk factors that apply from the pick list.;"['Age 60+', 'Anemia', 'Anorexia', 'Birthing labor', 'Bone marrow failure', 'Cancer', '   Breast cancer', '   Colorectal cancer', '   Hematologic malignancy', '   Lung cancer', '   Metastatic disease', 'Cancer treatment', '   Cancer surgery', '   Chemotherapy', '      Adjuvant chemotherapy', 'Cardiac disorder', 'Arrhythmia', '   Cardiac disease', '   Cardiomyopathy', '   Cardiac injury', '   Hypertension (high blood pressure)', '   Hypotension (low blood pressure)', 'Cesarean section', 'Chronic cough', 'Chronic gastrointestinal disease', 'Chronic lung disease', 'Corticosteroids', 'Diabetes mellitus (diabetes)', '   Type I diabetes mellitus (T1D)', '   Type II diabetes mellitus (T2D)', 'Eczema', 'Electrolyte disturbance', '   Hypocalcemia', '   Hypokalemia', '   Hypomagnesemia', 'Encephalitis (brain inflammation)', 'Epilepsy', 'Hemodialysis', 'Hemoglobinopathy', 'Human immunodeficiency virus (HIV)', '   Acquired immunodeficiency syndrome (AIDS)', '   HIV and antiretroviral therapy (ART)', 'Immunocompromised', '   Lupus', 'Inflammatory bowel disease (IBD)', '   Colitis', '      Ulcerative colitis', ""   Crohn's disease"", 'Renal disorder', '   Renal disease', '      Chronic renal disease', '   Renal failure', 'Liver disease', '   Chronic liver disease', '      Fatty liver disease (FLD)', 'Myalgia (muscle pain) ', 'Myalgic encephalomyelitis (ME)', 'Neurological disorder', '   Neuromuscular disorder', 'Obesity', '   Severe obesity', 'Respiratory disorder', '   Asthma', '   Chronic bronchitis', '   Chronic pulmonary disease', '      Chronic obstructive pulmonary disease', '   Emphysema', '   Lung disease', '      Chronic lung disease', '      Pulmonary fibrosis', 'Pneumonia', '   Respiratory failure', '      Adult respiratory distress syndrome', '      Newborn respiratory distress syndrome', '   Tuberculosis', 'Postpartum (<= 6 weeks)', 'Pregnancy', 'Rheumatic disease', 'Sickle cell disease', 'Substance use', '   Alcohol abuse', '   Drug abuse', '      Injection drug abuse', '   Smoking', '   Vaping', 'Tachypnea (accelerated respiratory rate)', 'Transplant', '   Bone marrow transplant', '   Cardiac transplant', '   Hematopoietic stem cell transplant (HSCT)', '   Kidney transplant', '   Liver transplant', 'Not Applicable', 'Not Collected', 'Not Provided', 'Missing', 'Restricted Access']"
complications;Optional;Patient medical complications that are believed to have occurred as a result of host disease.;Enums;Acute Respiratory Failure;Select all of the complications experienced by the host from the pick list. ;"['Abnormal blood oxygen level', 'Acute respiratory failure', 'Arrhythmia (complication)', '   Tachycardia', '      Polymorphic ventricular tachycardia (VT)', '      Tachyarrhythmia', 'Noncardiogenic pulmonary edema', '   Acute respiratory distress syndrome (ARDS)', '      COVID-19 associated ARDS (CARDS)', '      Neurogenic pulmonary edema (NPE)', 'Cardiac injury', 'Cardiac arrest', 'Cardiogenic shock', 'Blood clot', '   Arterial clot', '   Deep vein thrombosis (DVT)', '   Pulmonary embolism (PE)', 'Cardiomyopathy', 'Central nervous system invasion', 'Stroke (complication)', '   Central Nervous System Vasculitis', '   Ischemic stroke', '      Acute ischemic stroke', 'Coma', 'Convulsions', 'COVID-19 associated coagulopathy (CAC)', 'Cystic fibrosis', 'Cytokine release syndrome', 'Disseminated intravascular coagulation (DIC)', 'Encephalopathy', 'Fulminant myocarditis', 'Guillain-Barre syndrome', 'Internal hemorrhage (complication; internal bleeding)', '   Intracerebral haemorrhage', 'Kawasaki disease', '   Typical Kawasaki disease', '   Incomplete Kawasaki disease', 'Kidney injury', '   Acute kidney injury', 'Liver dysfunction', 'Liver injury', '   Acute liver injury', 'Lung injury', '   Acute lung injury', 'Meningitis', 'Migraine', 'Miscarriage', 'Multisystem inflammatory syndrome in children (MIS-C)', 'Muscle injury', 'Myalgic encephalomyelitis (ME)', 'Myocardial infarction (heart attack)', '   Acute myocardial infarction', '   Elevation myocardial infarction', '   ST-segment elevation myocardial infarction', 'Myocardial injury', 'Neonatal complications', 'Organ failure', '   Heart failure', '   Liver failure', 'Paralysis', 'Pneumothorax (collapsed lung)', '   Spontaneous pneumothorax', '   Spontaneous tension pneymothorax', 'Pneumonia (complication)', '   COVID-19 pneumonia', 'Pregancy complications', 'Rhabdomyolysis', 'Secondary infection', '   Secondary staph infection', '   Secondary strep infection', 'Seizure (complication)', '   Motor seizure', 'Sepsis', 'Septicemia', 'Shock', '   Hyperinflammatory shock', '   Refractory cardiogenic shock', '   Refractory cardiogenic plus vasoplegic shock', '   Septic shock', 'Vasculitis', 'Ventilation induced lung injury (VILI)', 'Not Applicable', 'Not Collected', 'Not Provided', 'Missing', 'Restricted Access']"
host vaccination status;Optional;The vaccination status of the host (fully vaccinated, partially vaccinated, or not vaccinated).;Enums;Fully Vaccinated;Select the vaccination status of the host from the pick list.;['Fully Vaccinated', 'Partially Vaccinated', 'Not Vaccinated', 'Not Applicable', 'Not Collected', 'Not Provided', 'Missing', 'Restricted Access']
vaccine name;Optional;The name of the vaccine.;String;BNT162b2, Pfizer-BioNTech;Free text. Provide the scientific/research name of the vaccine followed by the name of the manufacturer, separated by a comma.;
number of vaccine doses received;Optional;The number of doses of the vaccine recived by the host.;Int;2;Record how many doses of the vaccine the host has received.;
first dose vaccination date;Optional;The date the host was first vaccinated.;Date;26/02/2021;"Provide the date that the first dose of the vaccine was administered. Provide the first dose vaccination date in ISO 8601 standard format ""YYYY-MM-DD"".";
last dose vacicnation date;Optional;The date the host received their last dose of vaccine.;Date;09/04/2021;"Provide the date that the last dose of the vaccine was administered. Provide the last dose vaccination date in ISO 8601 standard format ""YYYY-MM-DD"".";
location of exposure geo_loc name (country);Optional;The country where the host was likely exposed to the causative agent of the illness.;Enums;Canada;This location pertains to the country the host was believed to be exposed, and may not be the same as the host's country of residence. If known, provide the country name from the pick list.;"['Afghanistan', 'Albania', 'Algeria', 'American Samoa', 'Andorra', 'Angola', 'Anguilla', 'Antarctica', 'Antigua and Barbuda', 'Argentina', 'Armenia', 'Aruba', 'Ashmore and Cartier Islands', 'Australia', 'Austria', 'Azerbaijan', 'Bahamas', 'Bahrain', 'Baker Island', 'Bangladesh', 'Barbados', 'Bassas da India', 'Belarus', 'Belgium', 'Belize', 'Benin', 'Bermuda', 'Bhutan', 'Bolivia', 'Borneo', 'Bosnia and Herzegovina', 'Botswana', 'Bouvet Island', 'Brazil', 'British Virgin Islands', 'Brunei', 'Bulgaria', 'Burkina Faso', 'Burundi', 'Cambodia', 'Cameroon', 'Canada', 'Cape Verde', 'Cayman Islands', 'Central African Republic', 'Chad', 'Chile', 'China', 'Christmas Island', 'Clipperton Island', 'Cocos Islands', 'Colombia', 'Comoros', 'Cook Islands', 'Coral Sea Islands', 'Costa Rica', ""Cote d'Ivoire"", 'Croatia', 'Cuba', 'Curacao', 'Cyprus', 'Czech Republic', 'Democratic Republic of the Congo', 'Denmark', 'Djibouti', 'Dominica', 'Dominican Republic', 'Ecuador', 'Egypt', 'El Salvador', 'Equatorial Guinea', 'Eritrea', 'Estonia', 'Eswatini', 'Ethiopia', 'Europa Island', 'Falkland Islands (Islas Malvinas)', 'Faroe Islands', 'Fiji', 'Finland', 'France', 'French Guiana', 'French Polynesia', 'French Southern and Antarctic Lands', 'Gabon', 'Gambia', 'Gaza Strip', 'Georgia', 'Germany', 'Ghana', 'Gibraltar', 'Glorioso Islands', 'Greece', 'Greenland', 'Grenada', 'Guadeloupe', 'Guam', 'Guatemala', 'Guernsey', 'Guinea', 'Guinea-Bissau', 'Guyana', 'Haiti', 'Heard Island and McDonald Islands', 'Honduras', 'Hong Kong', 'Howland Island', 'Hungary', 'Iceland', 'India', 'Indonesia', 'Iran', 'Iraq', 'Ireland', 'Isle of Man', 'Israel', 'Italy', 'Jamaica', 'Jan Mayen', 'Japan', 'Jarvis Island', 'Jersey', 'Johnston Atoll', 'Jordan', 'Juan de Nova Island', 'Kazakhstan', 'Kenya', 'Kerguelen Archipelago', 'Kingman Reef', 'Kiribati', 'Kosovo', 'Kuwait', 'Kyrgyzstan', 'Laos', 'Latvia', 'Lebanon', 'Lesotho', 'Liberia', 'Libya', 'Liechtenstein', 'Line Islands', 'Lithuania', 'Luxembourg', 'Macau', 'Madagascar', 'Malawi', 'Malaysia', 'Maldives', 'Mali', 'Malta', 'Marshall Islands', 'Martinique', 'Mauritania', 'Mauritius', 'Mayotte', 'Mexico', 'Micronesia', 'Midway Islands', 'Moldova', 'Monaco', 'Mongolia', 'Montenegro', 'Montserrat', 'Morocco', 'Mozambique', 'Myanmar', 'Namibia', 'Nauru', 'Navassa Island', 'Nepal', 'Netherlands', 'New Caledonia', 'New Zealand', 'Nicaragua', 'Niger', 'Nigeria', 'Niue', 'Norfolk Island', 'North Korea', 'North Macedonia', 'North Sea', 'Northern Mariana Islands', 'Norway', 'Oman', 'Pakistan', 'Palau', 'Panama', 'Papua New Guinea', 'Paracel Islands', 'Paraguay', 'Peru', 'Philippines', 'Pitcairn Islands', 'Poland', 'Portugal', 'Puerto Rico', 'Qatar', 'Republic of the Congo', 'Reunion', 'Romania', 'Ross Sea', 'Russia', 'Rwanda', 'Saint Helena', 'Saint Kitts and Nevis', 'Saint Lucia', 'Saint Pierre and Miquelon', 'Saint Vincent and the Grenadines', 'Samoa', 'San Marino', 'Sao Tome and Principe', 'Saudi Arabia', 'Senegal', 'Serbia', 'Seychelles', 'Sierra Leone', 'Singapore', 'Sint Maarten', 'Slovakia', 'Slovenia', 'Solomon Islands', 'Somalia', 'South Africa', 'South Georgia and the South Sandwich Islands', 'South Korea', 'South Sudan', 'Spain', 'Spratly Islands', 'Sri Lanka', 'State of Palestine', 'Sudan', 'Suriname', 'Svalbard', 'Swaziland', 'Sweden', 'Switzerland', 'Syria', 'Taiwan', 'Tajikistan', 'Tanzania', 'Thailand', 'Timor-Leste', 'Togo', 'Tokelau', 'Tonga', 'Trinidad and Tobago', 'Tromelin Island', 'Tunisia', 'Turkey', 'Turkmenistan', 'Turks and Caicos Islands', 'Tuvalu', 'USA', 'Uganda', 'Ukraine', 'United Arab Emirates', 'United Kingdom', 'Uruguay', 'Uzbekistan', 'Vanuatu', 'Venezuela', 'Viet Nam', 'Virgin Islands', 'Wake Island', 'Wallis and Futuna', 'West Bank', 'Western Sahara', 'Yemen', 'Zambia', 'Zimbabwe', 'Not Applicable', 'Not Collected', 'Not Provided', 'Missing', 'Restricted Access']"
destination of most recent travel (city);Optional;The name of the city that was the destination of most recent travel.;String;New York City;Provide the name of the city that the host travelled to. Use this look-up service to identify the standardized term: https://www.ebi.ac.uk/ols/ontologies/gaz;
destination of most recent travel ((state/province/territory);Optional;The name of the province that was the destination of most recent travel.;String;California;Provide the name of the state/province/territory that the host travelled to. Use this look-up service to identify the standardized term: https://www.ebi.ac.uk/ols/ontologies/gaz;
destination of most recent travel (country);Optional;The name of the country that was the destination of most recent travel.;String;United Kingdom;Provide the name of the country that the host travelled to. Use this look-up service to identify the standardized term: https://www.ebi.ac.uk/ols/ontologies/gaz;
most recent travel departure date;Optional;The date of a person's most recent departure from their primary residence (at that time) on a journey to one or more other locations.;Date;16/03/2020;"Provide the travel departure date in ISO 8601 standard format ""YYYY-MM-DD"".";
most recent travel return date;Optional;The date of a person's most recent return to some residence from a journey originating at that residence.;Date;26/04/2020;"Provide the travel return date in ISO 8601 standard format ""YYYY-MM-DD"".";
travel history;Optional;Travel history in last six months.;String;Canada, Vancouver, USA, Seattle, Italy, Milan;Specify the countries (and more granular locations if known) travelled in the last six months, can include multiple travels. Separate multiple travel events with a semicolon. Provide as free text.;
exposure event;Optional;Event leading to exposure.;Enums;Mass gathering (convention);If known, select the exposure event from the pick list.;['Mass Gathering', '   Convention', '   Convocation', '   Agricultural Event', 'Religious Gathering', '   Mass', 'Social Gathering', '   Baby Shower', '   Community Event', '   Family Gathering', '      Family Reunion', '   Funeral', '   Party', '   Potluck', '   Wedding', 'Not Applicable', 'Not Collected', 'Not Provided', 'Missing', 'Restricted Access']
exposure contact level;Optional;The exposure transmission contact type.;Enums;Direct;Select direct or indirect exposure from the pick list.;['Direct (human-to-human contact)', 'Indirect contact', '  Close contact (face-to-face contact)', '  Casual contact', 'Not Applicable', 'Not Collected', 'Not Provided', 'Missing', 'Restricted Access']
host role;Optional;The role of the host in relation to the exposure setting.;Enums;Patient;Select the host's personal role(s) from the pick list provided in the template. If the desired term is missing, contact the curation team.;['Attendee', '   Student', 'Patient', '   Inpatient', '   Outpatient', 'Passenger', 'Resident', 'Visitor', 'Volunteer', 'Work', '   Administrator', '   First Responder', '      Firefighter', '      Paramedic', '      Police Officer', '   Housekeeper', '   Kitchen Worker', '   Laboratory Worker', '   Nurse', '   Personal Care Aid', '   Pharmacist', '   Physician', '   Vet', 'Social role', '   Acquaintance of case', '   Relative of case', '      Child of case', '      Parent of case', '         Father of case ', '         Mother of case', '   Spouse of case', 'Not Applicable', 'Not Collected', 'Not Provided', 'Missing', 'Restricted Access']
exposure setting;Optional;The setting leading to exposure.;Enums;Healthcare Setting;Select the host exposure setting(s) from the pick list provided in the template. If a desired term is missing, contact the curation team.;"['Human Exposure', '   Contact with Known COVID-19 Case', '   Contact with Patient', '   Contact with Probable COVID-19 Case', '   Contact with Person with Acute Respiratory Illness', '   Contact with Person with Fever and/or Cough', '   Contact with Person who Recently Travelled', 'Occupational, Residency or Patronage Exposure', '   Abbatoir', '   Animal Rescue', '   Childcare', '      Daycare', '      Nursery', '   Community Service Centre', '   Correctional Facility', '   Dormitory', '   Farm', '   First Nations Reserve', '   Funeral Home', '   Group Home', '   Healthcare Setting', '      Ambulance', '      Acute Care Facility', '      Clinic', '      Community Health Centre', '      Hospital', '         Emergency Department', '         ICU', '         Ward', '   Household', '   Insecure Housing (Homeless)', '   Laboratory', '   Long-Term Care Facility', '   Occupational Exposure', '      Worksite', '         Office', '   Outdoors', '      Camp/camping', '      Hiking Trail', '      Hunting Ground', '      Ski Resort', '   Petting zoo', '   Pharmacy', ""   Physician's Office"", '   Place of Worship', '      Church', '      Mosque', '      Temple', '   Restaurant', '   Retail Store', '   School', '   Temporary Residence', '      Homeless Shelter', '      Hotel', '   Veterinary Care Clinic', 'Travel Exposure', '   Travelled', '      Travelled on a Cruise Ship', '      Travelled on a Plane', '      Travelled on Ground Transport', '      Travelled outside Province/Territory', '      Travelled outside Canada', 'Not Applicable', 'Not Collected', 'Not Provided', 'Missing', 'Restricted Access']"
exposure details;Optional;Additional host exposure information.;String;Host role - Other: Bus Driver;Free text description of the exposure.;
prior SARS-CoV-2 infection;Optional;Whether there was prior SARS-CoV-2 infection.;Enums;Yes;If known, provide infromation about whether the individual had a previous SARS-CoV-2 infection. Select a value from the pick list.;['Yes', 'No ', 'Unknown', 'Not Applicable', 'Not Collected', 'Not Provided', 'Missing', 'Restricted Access']
prior SARS-CoV-2 infection isolate;Optional;The identifier of the isolate found in the prior SARS-CoV-2 infection.;String;SARS-CoV-2/human/USA/CA-CDPH-001/2020;"Provide the isolate name of the most recent prior infection. Structure the ""isolate"" name to be ICTV/INSDC compliant in the following format: ""SARS-CoV-2/host/country/sampleID/date"".";
prior SARS-CoV-2 infection date;Optional;The date of diagnosis of the prior SARS-CoV-2 infection.;Date;23/01/2021;"Provide the date that the most recent prior infection was diagnosed. Provide the prior SARS-CoV-2 infection date in ISO 8601 standard format ""YYYY-MM-DD"".";
prior SARS-CoV-2 antiviral treatment;Optional;Whether there was prior SARS-CoV-2 treatment with an antiviral agent.;Enums;No prior antiviral treatment;If known, provide infromation about whether the individual had a previous SARS-CoV-2 antiviral treatment. Select a value from the pick list.;['Prior antiviral treatment', 'No prior antiviral treatment', 'Unknown', 'Not Applicable', 'Not Collected', 'Not Provided', 'Missing', 'Restricted Access']
prior SARS-CoV-2 antiviral treatment agent;Optional;The name of the antiviral treatment agent administered during the prior SARS-CoV-2 infection.;String;Remdesivir;"Provide the name of the antiviral treatment agent administered during the most recent prior infection. If no treatment was administered, put ""No treatment"". If multiple antiviral agents were administered, list them all separated by commas.";
prior SARS-CoV-2 antiviral treatment date;Optional;The date treatment was first administered during the prior SARS-CoV-2 infection.;Date;28/01/2021;"Provide the date that the antiviral treatment agent was first administered during the most recenrt prior infection. Provide the prior SARS-CoV-2 treatment date in ISO 8601 standard format ""YYYY-MM-DD"".";
purpose of sequencing ;Recommended;The reason that the sample was sequenced.;Enums;Research;"The reason why a sample was originally collected may differ from the reason why it was selected for sequencing. The reason a sample was sequenced may provide information about potential biases in sequencing strategy. Provide the purpose of sequencing from the picklist in the template. The reason for sample collection should be indicated in the ""purpose of sampling"" field. ";['Baseline surveillance (random sampling)', 'Targeted surveillance (non-random sampling)', '    Priority surveillance projects', '        Screening for Variants of Concern (VOC)', '        Longitudinal surveillance (repeat sampling of individuals) ', '        Re-infection surveillance', '        Vaccine escape surveillance', '        Travel-associated surveillance', '              Domestic travel surveillance', '              International travel surveillance', 'Cluster/Outbreak investigation', '    Multi-jurisdictional outbreak investigation', '    Intra-jurisdictional outbreak investigation', 'Research', '    Viral passage experiment', '    Protocol testing ', 'Not Applicable', 'Not Collected', 'Not Provided', 'Missing', 'Restricted Access']
purpose of sequencing details;Optional;The description of why the sample was sequenced providing specific details.;Enums;Screened for S gene target failure (S dropout);Provide an expanded description of why the sample was sequenced using free text. The description may include the importance of the sequences for a particular public health investigation/surveillance activity/research question. Suggested standardized descriotions include: Screened for S gene target failure (S dropout), Screened for mink variants, Screened for B.1.1.7 variant, Screened for B.1.135 variant, Screened for P.1 variant, Screened due to travel history, Screened due to close contact with infected individual, Assessing public health control measures, Determining early introductions and spread, Investigating airline-related exposures, Investigating temporary foreign worker, Investigating remote regions, Investigating health care workers, Investigating schools/universities, Investigating reinfection.;['Screened for S gene target failure (S dropout)', 'Screened for mink variants', 'Screened for B.1.1.7 variant', 'Screened for B.1.135 variant', 'Screened for P.1 variant', 'Screened due to travel history', 'Screened due to close contact with infected individual', 'Assessing public health control measures', 'Determining early introductions and spread', 'Investigating airline-related exposures', 'Investigating temporary foreign worker ', 'Investigating remote regions', 'Investigating health care workers', 'Investigating schools/universities', 'Investigating reinfection']
sequencing date;Optional;The date the sample was sequenced.;Date;22/06/2020;"Provide the sequencing date in ISO 8601 standard format ""YYYY-MM-DD"".";
library ID;Optional;The user-specified identifier for the library prepared for sequencing.;String;XYZ_123345;The library name should be unique, and can be an autogenerated ID from your LIMS, or modification of the isolate ID.;
amplicon size;Optional;The length of the amplicon generated by PCR amplification.;String;300bp;Provide the amplicon size, including the units.;
library preparation kit;Optional;The name of the DNA library preparation kit used to generate the library being sequenced.;String;Nextera XT;Provide the name of the library preparation kit used.;
flow cell barcode;Optional;The barcode of the flow cell used for sequencing.;String;FAB06069;Provide the barcode of the flow cell used for sequencing the sample.;
sequencing instrument;Required;The model of the sequencing instrument used.;Enums;MinIon;Select the sequencing instrument from the pick list.;['Illumina', '   Illumina Genome Analyzer', '      Illumina Genome Analyzer II', '      Illumina Genome Analyzer IIx', '   Illumina HiScanSQ', '   Illumina HiSeq ', '      Illumina HiSeq X ', '         Illumina HiSeq X Five', '         Illumina HiSeq X Ten', '      Illumina HiSeq 1000', '      Illumina HiSeq 1500', '      Illumina HiSeq 2000', '      Illumina HiSeq 2500', '      Illumina HiSeq 3000', '      Illumina HiSeq 4000', '   Illumina iSeq  ', '   Illumina iSeq 100', '   Illumina NovaSeq  ', '   Illumina NovaSeq 6000', '   Illumina MiniSeq', '   Illumina MiSeq', '   Illumina NextSeq ', '      Illumina NextSeq 500', '      Illumina NextSeq 550', 'Pacific Biosciences', '   PacBio RS', '   PacBio RS II', '   PacBio Sequel', '   PacBio Sequel II', 'Ion Torrent', '   Ion Torrent PGM', '   Ion Torrent Proton', '   Ion Torrent S5 XL', '   Ion Torrent S5', 'Oxford Nanopore', '   GridION', '   MinION', '   PromethION', 'BGI Genomics', '   BGISEQ-500', 'MGI', 'DNBSEQ-T7', 'DNBSEQ-G400', 'DNBSEQ-G400 FAST', 'DNBSEQ-G50', 'Not Applicable', 'Not Collected', 'Not Provided', 'Missing', 'Restricted Access']
sequencing protocol name;Recommended;The name and version number of the sequencing protocol used.;String;1D_DNA_MinION, ARTIC Network Protocol V3;Provide the name and version of the sequencing protocol.;
sequencing protocol  ;Optional;The protocol used to generate the sequence.;String;Genomes were generated through amplicon sequencing of 1200 bp amplicons with Freed schema primers. Libraries were created using Illumina DNA Prep kits, and sequence data was produced using Miseq Micro v2 (500 cycles) sequencing kits.;"Provide a free text description of the methods and materials used to generate the sequence. Suggested text, fill in information where indicated.: ""Viral sequencing was performed following a tiling amplicon strategy using the <fill in> primer scheme. Sequencing was performed using a <fill in> sequencing instrument. Libraries were prepared using <fill in> library kit. """;
sequencing kit number;Optional;The manufacturer's kit number.;String;AB456XYZ789;Alphanumeric value.;
amplicon pcr primer scheme;Optional;The specifications of the primers (primer sequences, binding positions, fragment size generated etc) used to generate the amplicons to be sequenced.;String;https://github.com/joshquick/artic-ncov2019/blob/master/primer_schemes/nCoV-2019/V3/nCoV-2019.tsv;Provide the name and version of the primer scheme used to generate the amplicons for sequencing.;
raw sequence data processing method;Recommended;The method used for raw data processing such as removing barcodes, adapter trimming, filtering etc.;String;Porechop 0.2.3,Porechop 0.2.3;" """;
dehosting method;Recommended;The method used to remove host reads from the pathogen sequence.;String;Nanostripper;Nanostripper;
consensus sequence name ;Optional;The name of the consensus sequence.;String;ncov123assembly3;ncov123assembly3;
consensus sequence filename;Optional;The name of the consensus sequence file.;String;ncov123assembly.fasta;ncov123assembly.fasta;
consensus sequence filepath;Optional;The filepath of the consesnsus sequence file.;String;/User/Documents/RespLab/Data/ncov123assembly.fasta;/User/Documents/RespLab/Data/ncov123assembly.fasta;
consensus sequence software name;Required;The name of software used to generate the consensus sequence.;String;Ivar;Ivar;
consensus sequence software version;Required;The version of the software used to generate the consensus sequence.;String;1.3;1.3;
breadth of coverage value;Optional;The percentage of the reference genome covered by the sequenced data, to a prescribed depth.;Float;0.95;95%;
depth of coverage value;Optional;The average number of reads representing a given nucleotide in the reconstructed sequence.;Float;400;400x;
depth of coverage threshold;Optional;The threshold used as a cut-off for the depth of coverage.;Float;100;100x;
