Interface Label;Required/Optional;Definition;Value Type;Example;Guidance;Values
r1 fastq filename;Optional;The user-specified filename of the r1 FASTQ file.;String;ABC123_S1_L001_R1_001.fastq.gz;ABC123_S1_L001_R1_001.fastq.gz;
r2 fastq filename;Optional;The user-specified filename of the r2 FASTQ file.;String;ABC123_S1_L001_R2_001.fastq.gz;ABC123_S1_L001_R2_001.fastq.gz;
r1 fastq filepath;Optional;The filepath of the r1 FASTQ file.;String;/User/Documents/RespLab/Data/ABC123_S1_L001_R1_001.fastq.gz;/User/Documents/RespLab/Data/ABC123_S1_L001_R1_001.fastq.gz;
r2 fastq filepath;Optional;The filepath of the r2 FASTQ file.;String;/User/Documents/RespLab/Data/ABC123_S1_L001_R2_001.fastq.gz;/User/Documents/RespLab/Data/ABC123_S1_L001_R2_001.fastq.gz;
fast5 filename;Optional;The user-specified filename of the FAST5 file.;String;batch1a_sequences.fast5;batch1a_sequences.fast5;
fast5 filepath;Optional;The filepath of the FAST5 file.;String;/User/Documents/RespLab/Data/rona123assembly.fast5;/User/Documents/RespLab/Data/rona123assembly.fast5;
number of base pairs sequenced;Optional;The number of total base pairs generated by the sequencing process.;Int;387566;387566;
consensus genome length ;Optional;Size of the assembled genome described as the number of base pairs.;Int;38677;38677;
Ns per 100 kbp;Optional;The number of N symbols present in the consensus fasta sequence, per 100kbp of sequence.;Int;300;300;
reference genome accession;Optional;A persistent, unique identifier of a genome database entry.;String;NC_045512.2;NC_045512.2;
bioinformatics protocol;Optional;The name and version number of the bioinformatics protocol used.;String;https://www.protocols.io/groups/cphln-sarscov2-sequencing-consortium/members;https://www.protocols.io/groups/cphln-sarscov2-sequencing-consortium/members;
lineage/clade name;Optional;The name of the lineage or clade.;String;B.1.1.7;Provide the Pangolin or Nextstrain lineage/clade name.;
lineage/clade analysis software name;Optional;The name of the software used to determine the lineage/clade.;String;Pangolin;Provide the name of the software used to determine the lineage/clade.;
lineage/clade analysis software version;Optional;The version of the software used to determine the lineage/clade.;String;2.1.10;Provide the version of the software used ot determine the lineage/clade.;
variant designation;Optional;The variant classification of the lineage/clade i.e. variant, variant of concern.;Enums;Variant of Concern;If the lineage/clade is considered a Variant of Concern, select Variant of Concern from the pick list. If the lineage/clade contains mutations of concern (mutations that increase transmission, clincal severity, or other epidemiological fa ctors) but it not a global Variant of Concern, select Variant. If the lineage/clade does not contain mutations of concern, leave blank.;['Variant of Interest (VOI) ', 'Variant of Concern (VOC)']
variant evidence;Optional;The evidence used to make the variant determination.;String;lineage-defining mutations: ORF1ab (K1655N), Spike (K417N, E484K, N501Y, D614G, A701V), N (T205I), E (P71L);List the set of lineage-defining mutations used to make the variant determination. If there are mutations of interest/concern observed in addition to lineage-defining mutations, describe those here.;
gene name 1;Optional;The name of the gene used in the diagnostic RT-PCR test.;Enums;E (orf4);Select a gene from the pick list. If the gene of interest is not in the list, provide the full name of the gene or the gene symbol (short form of gene name). Standardized gene names and symbols can be found in the Gene Ontology using this look-up service: https://bit.ly/2Sq1LbI;"['E gene (orf4)', 'M gene (orf5)', 'N gene (orf9)', 'Spike gene (orf2)', 'orf1ab (rep)', '   orf1a (pp1a)', '      nsp11', '   nsp1 ', '   nsp2 ', '   nsp3 ', '   nsp4 ', '   nsp5 ', '   nsp6 ', '   nsp7 ', '   nsp8 ', '   nsp9 ', '   nsp10 ', '   RdRp gene (nsp12)', '   hel gene (nsp13)', '   exoN gene (nsp14)', '   nsp15', '   nsp16', 'orf3a', 'orf3b', 'orf6 (ns6)', 'orf7a', 'orf7b (ns7b)', 'orf8 (ns8)', 'orf9b', 'orf9c', 'orf10', 'orf14', ""SARS-COV-2 5' UTR"", 'Not Applicable', 'Not Collected', 'Not Provided', 'Missing', 'Restricted Access']"
diagnostic pcr protocol 1;Optional;The name and version number of the protocol used for diagnostic marker amplification.;String;PCREGene 2.0;The name and version number of the protocol used for carrying out a diagnostic PCR test. This information can be compared to sequence data for evaluation of performance and quality control.;
diagnostic pcr Ct value 1;Optional;The Ct value result from a diagnostic SARS-CoV-2 RT-PCR test.;Int;21;Provide the CT value of the sample from the diagnostic RT-PCR test.;
gene name 2;Optional;The name of the gene used in the diagnostic RT-PCR test.;Enums;nsp12 (RdRP);Select a gene from the pick list. If the gene of interest is not in the list, provide the full name of the gene or the gene symbol (short form of gene name). Standardized gene names and symbols can be found in the Gene Ontology using this look-up service: https://bit.ly/2Sq1LbI;"['E gene (orf4)', 'M gene (orf5)', 'N gene (orf9)', 'Spike gene (orf2)', 'orf1ab (rep)', '   orf1a (pp1a)', '      nsp11', '   nsp1 ', '   nsp2 ', '   nsp3 ', '   nsp4 ', '   nsp5 ', '   nsp6 ', '   nsp7 ', '   nsp8 ', '   nsp9 ', '   nsp10 ', '   RdRp gene (nsp12)', '   hel gene (nsp13)', '   exoN gene (nsp14)', '   nsp15', '   nsp16', 'orf3a', 'orf3b', 'orf6 (ns6)', 'orf7a', 'orf7b (ns7b)', 'orf8 (ns8)', 'orf9b', 'orf9c', 'orf10', 'orf14', ""SARS-COV-2 5' UTR"", 'Not Applicable', 'Not Collected', 'Not Provided', 'Missing', 'Restricted Access']"
diagnostic pcr protocol 2;Optional;The name and version number of the protocol used for diagnostic marker amplification.;String;PCRRdRpGene 3.0;The name and version number of the protocol used for carrying out a second diagnostic PCR test. This information can be compared to sequence data for evaluation of performance and quality control.;
diagnostic pcr Ct value 2;Optional;The cycle threshold (CT) value result from a diagnostic SARS-CoV-2 RT-PCR test.;Int;36;Provide the CT value of the sample from the second diagnostic RT-PCR test.;
authors;Recommended;Names of individuals contributing to the processes of sample collection, sequence generation, analysis, and data submission.;String;Tejinder Singh, Fei Hu, Johnny Blogs;Include the first and last names of all individuals that should be attributed, separated by a comma.;