Interface Label,Required/Optional,Definition,Value Type,Example,Guidance
bioproject umbrella accession,Optional,The INSDC umbrella accession number of the BioProject to which the BioSample belongs. ,Bioproject_ID,PRJNA623807,"Required if submission is linked to an umbrella BioProject. An umbrella BioProject links together related BioProjects. A valid BioProject umbrella accession has prefix PRJN, PRJE or PRJD. Your laboratory can have one or many BioProjects. "
bioproject accession,Optional,The INSDC accession number of the BioProject(s) to which the BioSample belongs. ,Bioproject_ID,PRJNA12345,"Required if submission is linked to a BioProject. BioProjects are an organizing tool that links together raw sequence data, assemblies, and their associated metadata. A valid BioProject accession has prefix PRJN, PRJE or PRJD, e.g., PRJNA12345 and is created once at the beginning of a new sequencing project. Your laboratory can have one or many BioProjects. "
biosample accession,Recommended,The identifier assigned to a BioSample in INSDC archives.,Biosample_ID,SAMN14180202,"Store the accession returned from the BioSample submission.  NCBI BioSamples will have the prefix SAMN, while EBI BioSamples will have the prefix SAMEA."
SRA accession ,Optional,"The Sequence Read Archive (SRA) identifier linking raw read data, methodological metadata and quality control metrics submitted to the INSDC.",SRA_ID,SRR11177792,"Store the accession assigned to the submitted ""run"". NCBI-SRA accessions start with SRR, while EBI-ENA runs start with ENA. "
GenBank accession,Optional,The GenBank identifier assigned to the sequence in the INSDC archives.,Genbank_ID,MN908947.3,Store the accession returned from a GenBank submission (viral genome assembly).
GISAID accession,Optional,The GISAID accession number assigned to the sequence.,GISAID_ID,EPI_ISL_123456,Store the accession returned from the GISAID submission. 
specimen collector sample ID,Required,The user-defined name for the sample. ,String,INSDC: SARS-CoV-2/human/USA/CA-CDPH-001/2020; GISAID: hCoV-19/USA-CDPH-001/2020,"Chose one of the following naming conventions for SARC-CoV-2 samples:
1) ICTV compliant name for INSDC submission: ""SARS-CoV-2/host/location/isolate/date""
2) GISAID naming convention: ""hCoV-19/location/isolate/date"""
sample collected by,Required,The name of the agency that collected the original sample.,String,Public Health Agency of Canada; Centers for Disease Control and Prevention,"The name of the agency should be written out in full, (with minor exceptions) and be consistent across multiple submissions."
sample collector contact email,Optional,The email address of the contact responsible for follow-up regarding the sample.,Email,johnnyblogs@lab.ca; RespLab@lab.ca,The email address can represent a specific individual or lab.
sample collector contact address,Optional,The mailing address of the agency submitting the sample.,String,"655 Lab St, Vancouver, British Columbia, V5N 2A2, Canada","The mailing address should be in the format: Street number and name, City, State/Province/Region, Country, Postal Code/Zip Code"
sequence submitted by,Required,The name of the agency that generated the sequence.,String,Public Health Agency of Canada; Centers for Disease Control and Prevention,"The name of the agency should be written out in full, (with minor exceptions) and be consistent across multiple submissions."
sequence submitter contact email,Optional,The email address of the contact responsible for follow-up regarding the sequence.,Email,johnnyblogs@lab.ca; RespLab@lab.ca,The email address can represent a specific individual or lab.
sequence submitter contact address,Optional,The mailing address of the agency submitting the sequence.,String,"123 Sunnybrooke St, Toronto, Ontario, M4P 1L6, Canada","The mailing address should be in the format: Street number and name, City, State/Province/Region, Country, Postal Code/Zip Code"
sample collection date,Required,The date on which the sample was collected.,Date,2020-03-16,"Sample collection date is critical for surveillance and many types of analyses. Required granularity includes year, month and day. If this date is considered identifiable information, it is acceptable to add ""jitter"" by adding or subtracting a calendar day (acceptable by GISAID). Alternatively, ”received date” may be used as a substitute. The date should be provided in ISO 8601 standard format ""YYYY-MM-DD""."
sample received date,Optional,The date on which the sample was received.,Date,2020-03-20,"ISO 8601 standard ""YYYY-MM-DD"", ""YYYY-MM"" or ""YYYY""."
geo_loc name (country),Required,Country of origin of the sample.,String,South Africa,Provide the country name from the picklist in the template
geo_loc name (state/province/region),Required,State/province/region of origin of the sample.,String,Western Cape,Provide the state/province/region name from the GAZ geography ontology. Search for geography terms here: https://www.ebi.ac.uk/ols/ontologies/gaz
organism,Required,Taxonomic name of the organism.,String,Severe acute respiratory coronavirus 2,Use Severe acute respiratory coronavirus 2.
isolate,Required,Identifier of the specific isolate.,String,INSDC: SARS-CoV-2/human/USA/CA-CDPH-001/2020; GISAID: hCoV-19/USA-CDPH-001/2020,"Chose one of the following naming conventions for SARC-CoV-2 samples:
1) ICTV compliant name for INSDC submission: ""SARS-CoV-2/host/location/isolate/date""
2) GISAID naming convention: ""hCoV-19/location/isolate/date"""
purpose of sampling,Recommended,The reason that the sample was collected.,String,Diagnostic testing,Select a value from the picklist in the template.
anatomical material,Optional,"A substance obtained from an anatomical part of an organism e.g. tissue, blood.",String,Blood,"Provide a descriptor if an anatomical material was sampled. Use the picklist provided in the template. If a desired term is missing from the picklist, use this look-up service to identify a standardized term: https://www.ebi.ac.uk/ols/ontologies/uberon. If not applicable, leave blank."
anatomical part,Optional,An anatomical part of an organism e.g. oropharynx. ,String,Nasopharynx,"Provide a descriptor if an anatomical part was sampled. Use the picklist provided in the template. If a desired term is missing from the picklist, use this look-up service to identify a standardized term: https://www.ebi.ac.uk/ols/ontologies/uberon. If not applicable, leave blank."
body product,Optional,"A substance excreted/secreted from an organism e.g. feces, urine, sweat.",String,Feces,"Provide a descriptor if a body product was sampled. Use the picklist provided in the template. If a desired term is missing from the picklist, use this look-up service to identify a standardized term: https://www.ebi.ac.uk/ols/ontologies/uberon. If not applicable, leave blank."
environmental material,Optional,"A substance obtained from the natural or man-made environment e.g. soil, water, sewage, door handle, bed handrail, face mask.",String,Face mask,"Provide a descriptor if an environmental material was sampled. Use the picklist provided in the template. If a desired term is missing from the picklist, use this look-up service to identify a standardized term: https://www.ebi.ac.uk/ols/ontologies/envo. If not applicable, leave blank."
environmental site,Optional,"An environmental location may describe a site in the natural or built environment e.g. hospital, wet market, bat cave.",String,Hospital room,"Provide a descriptor if an environmental site was sampled. Use the picklist provided in the template. If a desired term is missing from the picklist, use this look-up service to identify a standardized term: https://www.ebi.ac.uk/ols/ontologies/envo. If not applicable, leave blank."
collection device,Optional,The instrument or container used to collect the sample e.g. swab.,String,Swab,"Provide a descriptor if a collection device was used for sampling. Use the picklist provided in the template. If a desired term is missing from the picklist, use this look-up service to identify a standardized term: https://www.ebi.ac.uk/ols/ontologies/obi. If not applicable, leave blank."
collection method,Optional,"The process used to collect the sample e.g. phlebotomy, necropsy.",String,Bronchoalveolar lavage (BAL),"Provide a descriptor if a collection method was used for sampling. Use the picklist provided in the template. If a desired term is missing from the picklist, use this look-up service to identify a standardized term: https://www.ebi.ac.uk/ols/ontologies/obi. If not applicable, leave blank."
collection protocol,Optional,The name and version of a particular protocol used for sampling.,String,BCRonaSamplingProtocol 1.2,Free text.
specimen processing,Recommended,Any processing applied to the sample during or after receiving the sample. ,String,Virus passage,"Critical for interpreting data. Select all the applicable processes from the pick list. If virus was passaged, include information in ""lab host"", ""passage number"", and ""passage method"" fields. If none of the processes in the pick list apply, put ""not applicable""."
lab host,Recommended,Name and description of the laboratory host used to propagate the source organism or material from which the sample was obtained.,String,Vero E6 cell line,"Type of cell line used for propagation. Select a value form the pick list. If not passaged, put ""not applicable""."
passage number,Recommended,Number of passages.,Int,3,"Provide number of known passages. If not passaged, put ""not applicable"""
passage method,Recommended,Description of how organism was passaged.,String,,"Free text. Provide a very short description (<10 words). If not passaged, put ""not applicable""."
biomaterial extracted,Optional,The biomaterial extracted from samples for the purpose of sequencing.,String,RNA (total),Provide the biomaterial extracted from the picklist in the template.
host (common name),Optional,The commonly used name of the host.,String,Human,"Common name or scientific name are required if there was a host. Common name examples e.g. human, bat. Select a value form the pick list. If the sample was environmental, put ""not applicable""."
host (scientific name),Required,"The taxonomic, or scientific name of the host.",String,Homo sapiens,"Common name or scientific name are required if there was a host. Scientific name examples e.g. Homo sapiens. Select a value from the pick list. If the sample was environmental, put ""not applicable""."
host health state,Optional,Health status of the host at the time of sample collection.,String,Sick,"Select a value from the pick list. If unknown, put ""not provided""."
host health status details,Optional,Further details pertaining to the health or disease status of the host at time of collection.,String,Hospitalized (ICU),"If known, select a descriptor from the pick list provided in the template."
host disease,Required,The name of the disease experienced by the host.,String,COVID-19,"Select a value form the pick list. Provide ""COVID-19"" if the host tested positive for the disease. Put ""not collected"" if the information is unknown, or if the host (non-human) appears healthy. Note: ""COVID-19"" should still be provided if patient is asymptomatic."
host age,Recommended,Age of host at the time of sampling.,Integer_or_Range,79; 40-49,"Provide age in years. Age-binning is also acceptable. If not available, put ""not provided""."
host gender,Recommended,The gender of the host at the time of sample collection.,String,Male,"Select a value from the pick list. If not available, put ""not provided""."
host origin geo loc (country),Optional,The country of residence of the host.,String,United Kingdom,Provide the country name from the picklist in the template
host subject ID,Optional,A unique identifier by which each host can be referred to e.g. #131,String,BCxy123,"Should be a unique, user-defined identifier."
symptom onset date,Optional,The date on which the symptoms began or were first noted.,Date,2020-03-16,"ISO 8601 standard ""YYYY-MM-DD"", ""YYYY-MM"" or ""YYYY"""
signs and symptoms,Optional,"A perceived change in function or sensation, (loss, disturbance or appearance) indicative of a disease, reported by a patient.",String,"Cough, Fever, Chills",Select all of the symptoms experienced by the host form the pick list.
location of exposure geo_loc name (country),Optional,The country where the host was likely exposed to the causative agent of the illness.,String,Canada,Select the country name from pick list provided in the template.
travel history,Optional,Travel outside the country in last six months.,String,"Canada, Vancouver; USA, Seattle; Italy, Milan",Specify the countries (and more granular locations is known) travelled in the last six months; can include multiple travels. Separate multiple travel events with a semicolon. Provide as free text.
exposure event,Optional,Event leading to exposure.,String,Mass gathering (convention),Select the exposure event from the pick list.
library ID,Optional,The user-specified identifier for the library prepared for sequencing.,String,XYZ_123345,"The library name should be unique, and can be an autogenerated ID from your LIMS, or modification of the isolate ID."
sequencing instrument,Recommended,The model of the sequencing instrument used.,String,MinIon,Select the sequencing instrument form the pick list.
sequencing protocol name,Recommended,The name and version number of the sequencing protocol used.,String,"1D_DNA_MinION, ARTIC Network Protocol V3",Free text. Provide the name and version of the sequencing protocol. 
sequencing protocol source,Optional,The name of the organization/authors of the protocol.,String,ARTIC Network,Free text. Provide the name of the source of the protocol.
sequencing kit number,Optional,The manufacturer's kit number.,String,AB456XYZ789,Alphanumeric value.
amplicon pcr primers filename,Optional,The filename of the file containing amplicon PCR primer names and sequences.,String,ncov_primers_2020.txt,"Important for documenting methods and the user should consider including this information in their INSDC submission, particularly if primers were designed in-house and not by a public consortium/network."
raw sequence data processing ,Recommended,"The names of the software and version number used for raw data processing such as removing barcodes, adapter trimming, filtering etc.",String,Porechop v. 0.2.3,"Provide the software name followed by the version e.g. Trimmomatic 0.38, Porechop 0.2.3"
sequencing depth (average),Optional,The total number of sequenced base pairs divided by the expected number of base pairs in the genome.,Float,80,Provide the value as a fold of coverage.
assembly name,Optional,Name and version of the assembly provided by the submitter.,String,ncov123assembly.fasta,Provide the assembly name.
assembly method,Recommended,The name and version number of the assembler used.,String,Canu 2.0,Provide the software name followed by the version e.g. Canu 2.0
assembly coverage breadth,Optional,"The percentage of the reference genome covered by the sequenced data, to a prescribed depth.",Float,0.95,Provide value as a percent e.g. 95%.
assembly coverage depth,Optional,The average number of reads representing a given nucleotide in the reconstructed sequence.,Float,400,Provide value as a fold of coverage e.g. 80x.
r1 fastq filename,Optional,The user-specified filename of the r1 FASTQ file.,String,ABC123_S1_L001_R1_001.fastq.gz,Provide the r1 FASTQ filename.
r2 fastq filename,Optional,The user-specified filename of the r2 FASTQ file.,String,ABC123_S1_L001_R2_001.fastq.gz,Provide the r2 FASTQ filename.
fast5 filename,Optional,The user-specified filename of the FAST5 file.,String,batch1a_sequences.fast5,Provide the FAST5 filename.
fasta filename,Optional,The user-specified filename of the FASTA file.,String,batch1a_sequences.fasta,Provide the FASTA filename.
number base pairs,Optional,The number of total base pairs generated by the sequencing process.,Int,387566,Provide a numerical value (no need to include units).
consensus genome length ,Optional,Size of the assembled genome described as the number of base pairs.,Int,38677,Provide a numerical value (no need to include units).
mean contig length,Optional,The mean contig length is the count of base pairs in the average size contig of the sequence assembly.,Int,12689,Provide a numerical value (no need to include units).
N50,Optional,The minimum contig length needed to cover 50% of the genome.,Int,10500,Provide a numerical value (no need to include units).
Ns per 100 kbp,Optional,"The number of N symbols present in the consensus fasta sequence, per 100kbp of sequence.",Int,300,Provide a numerical value (no need to include units).
reference genome accession,Optional,"A persistent, unique identifier of a genome database entry.",String,NC_045512.2,Provide the accession number of the reference genome.
consensus sequence ID,Optional,The identifier used to specify the consensus sequence.,String,consensus_1,Provide the consensus sequence identifier.
consensus sequence method,Recommended,The name and version number of the software used to produce the consensus sequence.,String,iVar 1.2.1,Provide the software name followed by the version.
consensus sequence filename,Optional,The user-specified filename of the consensus sequence.,String,ProvConsensusSeq.fasta,Provide the consensus sequence filename.
annotation feature table filename,Optional,The filename of the file containing genome features such as gene names and corresponding CDS.,String,BCCoronaAnnotationFeatures,Provide the filename of the annotation feature table.
bioinformatics protocol,Optional,The name and version number of the bioinformatics protocol used.,String,https://www.protocols.io/groups/cphln-sarscov2-sequencing-consortium/members,"Further details regarding the methods used to process raw data, and/or generate assemblies, and/or generate consensus sequences can be provided in an SOP or protocol. Provide the name and version number of the protocol."
gene name 1,Optional,The name of the gene used in the diagnostic RT-PCR test.,String,envelope small membrane protein (SARS-CoV-2),Provide the full name of the gene used in the test. The gene symbol (short form of gene name) can also be provided. Standardized gene names and symbols can be found in the Gene Ontology using this look-up service: https://bit.ly/2Sq1LbI
diagnostic pcr protocol 1,Optional,The name and version number of the protocol used for diagnostic marker amplification.,String,AllTheTestingPCRingEGene v. 2,The name and version number of the protocol used for carrying out a diagnostic PCR test. This information can be compared to sequence data for evaluation of performance and quality control.
diagnostic pcr Ct value 1,Optional,The Ct value result from a diagnostic SARS-CoV-2 RT-PCR test.,Int,21,Provide the CT value of the sample from the diagnostic RT-PCR test.
gene name 2,Optional,The name of the gene used in the diagnostic RT-PCR test.,String,RNA-directed RNA Polymerase (RdRP),Provide the full name of another gene used in an RT-PCR test. The gene symbol (short form of gene name) can also be provided. Standardized gene names and symbols can be found in the Gene Ontology using this look-up service: https://bit.ly/2Sq1LbI
diagnostic pcr protocol 2,Optional,The name and version number of the protocol used for diagnostic marker amplification.,String,AllTheTestingPCRingRdRpGene v. 3,The name and version number of the protocol used for carrying out a second diagnostic PCR test. This information can be compared to sequence data for evaluation of performance and quality control.
diagnostic pcr Ct value 2,Optional,The Ct value result from a diagnostic SARS-CoV-2 RT-PCR test.,Int,36,Provide the CT value of the sample from the second diagnostic RT-PCR test.
authors,Recommended,"Names of individuals contributing to the processes of sample collection, sequence generation, analysis, and data submission.",String,"Tejinder Singh, Fei Hu, Johnny Blogs","Include the first and last names of all individuals that should be attributed, separated by a comma."